Question,ID,Link
Select rows from a DataFrame based on values in a column in pandas,17071871,http://stackoverflow.com/questions/17071871/select-rows-from-a-dataframe-based-on-values-in-a-column-in-pandas
How to form tuple column from two columns in Pandas,16031056,http://stackoverflow.com/questions/16031056/how-to-form-tuple-column-from-two-columns-in-pandas
Delete column from pandas DataFrame,13411544,http://stackoverflow.com/questions/13411544/delete-column-from-pandas-dataframe
create a tuple from columns in a pandas DataFrame,32485488,http://stackoverflow.com/questions/32485488/create-a-tuple-from-columns-in-a-pandas-dataframe
Return rows in pandas dataframe where tuple in column contains a certain value,29463068,http://stackoverflow.com/questions/29463068/return-rows-in-pandas-dataframe-where-tuple-in-column-contains-a-certain-value
"Python pandas: dataframe grouped by a column(such as, name), and get the value of some columns in each group",39247335,http://stackoverflow.com/questions/39247335/python-pandas-dataframe-grouped-by-a-columnsuch-as-name-and-get-the-value-o
Adding new column to existing DataFrame in Python pandas,12555323,http://stackoverflow.com/questions/12555323/adding-new-column-to-existing-dataframe-in-python-pandas
Dataframe column data - pandas - python,36465339,http://stackoverflow.com/questions/36465339/dataframe-column-data-pandas-python
How to drop rows of Pandas dataframe whose value of certain column is NaN,13413590,http://stackoverflow.com/questions/13413590/how-to-drop-rows-of-pandas-dataframe-whose-value-of-certain-column-is-nan
Renaming columns in pandas,11346283,http://stackoverflow.com/questions/11346283/renaming-columns-in-pandas
